{
  "$schema": "https://json-schema.org/draft/2020-12/schema",
  "type": "object",
  "properties": {
    "title": {
      "type": "string"
    },
    "date": {
      "type": "string"
    },
    "description": {
      "type": "string"
    },
    "coverPhoto": {
      "type": "string"
    },
    "photos": {
      "type": "array",
      "items": {
        "type": "string"
      }
    },
    "$schema": {
      "type": "string"
    }
  },
  "required": [
    "title",
    "date",
    "coverPhoto",
    "photos"
  ]
}