{
  "title": "Mangrove Restoration 2024",
  "date": "2024-09-08",
  "description": "Behind the scenes of our mangrove restoration project at Addu Atoll — 500 saplings planted, futures protected.",
  "coverPhoto": "/images/uploads/gallery-mangrove-2024-cover.jpg",
  "photos": [
    "/images/uploads/gallery-mangrove-2024-1.jpg",
    "/images/uploads/gallery-mangrove-2024-2.jpg",
    "/images/uploads/gallery-mangrove-2024-3.jpg",
    "/images/uploads/gallery-mangrove-2024-4.jpg"
  ]
}
