{
  "title": "Beach Cleanup 2025",
  "date": "2025-03-15",
  "description": "Snapshots from our annual beach cleanup at Hulhumale — 90+ volunteers, 250kg of waste collected, and a coastline made cleaner for everyone.",
  "coverPhoto": "/images/uploads/gallery-cleanup-2025-cover.jpg",
  "photos": [
    "/images/uploads/gallery-cleanup-2025-1.jpg",
    "/images/uploads/gallery-cleanup-2025-2.jpg",
    "/images/uploads/gallery-cleanup-2025-3.jpg",
    "/images/uploads/gallery-cleanup-2025-4.jpg",
    "/images/uploads/gallery-cleanup-2025-5.jpg"
  ]
}
